<!DOCTYPE Modelo SYSTEM "modelo-comp.dtd"> 
<Modelo>
	<Entidad id="0">
		<Nombre>Localidad</Nombre>
		<TipoEntidad tipo="MAESTRA_COSA"/>
		<Atributos>
			<Atributo id="01">
				<Nombre>fila</Nombre>
				<Cardinalidad min="1" max="1" />
				<TipoAtributo tipo="CARACTERIZACION"/>
			</Atributo>
			<Atributo id="02">
				<Nombre>butaca</Nombre>
				<Cardinalidad min="1" max="1" />
				<TipoAtributo tipo="CARACTERIZACION"/>
			</Atributo>
		</Atributos>
		<IdentificadoresExternos>
			<RefEntidad id="2" />
		</IdentificadoresExternos>
	</Entidad>
	<Entidad id="2">
		<Nombre>SeccionSala</Nombre>
		<TipoEntidad tipo="MAESTRA_COSA"/>
		<Atributos>
			<Atributo id="24">
				<Nombre>nroSecc</Nombre>
				<Cardinalidad min="1" max="1" />
				<TipoAtributo tipo="CARACTERIZACION"/>
			</Atributo>
			<Atributo id="25">
				<Nombre>nomSecc</Nombre>
				<Cardinalidad min="1" max="1" />
				<TipoAtributo tipo="CARACTERIZACION"/>
			</Atributo>
		</Atributos>
	</Entidad>
	<Entidad id="4">
		<Nombre>Obra</Nombre>
		<TipoEntidad tipo="MAESTRA_COSA"/>
		<Atributos>
			<Atributo id="41">
				<Nombre>idObra</Nombre>
				<Cardinalidad min="1" max="1" />
				<TipoAtributo tipo="CARACTERIZACION"/>
			</Atributo>
			<Atributo id="42">
				<Nombre>titulo</Nombre>
				<Cardinalidad min="1" max="1" />
				<TipoAtributo tipo="CARACTERIZACION"/>
			</Atributo>
			<Atributo id="43">
				<Nombre>autor</Nombre>
				<Cardinalidad min="1" max="n" />
				<TipoAtributo tipo="CARACTERIZACION"/>
			</Atributo>
			<Atributo id="45">
				<Nombre>director</Nombre>
				<Cardinalidad min="1" max="n" />
				<TipoAtributo tipo="CARACTERIZACION"/>
			</Atributo>
			<Atributo id="46">
				<Nombre>genero</Nombre>
				<Cardinalidad min="1" max="1" />
				<TipoAtributo tipo="CARACTERIZACION"/>
			</Atributo>
			<Atributo id="47">
				<Nombre>nroProxFunc</Nombre>
				<Cardinalidad min="1" max="1" />
				<TipoAtributo tipo="CARACTERIZACION"/>
			</Atributo>
		</Atributos>
		<IdentificadoresInternos>
			<RefAtributo id="41" />
			<RefAtributo id="42" />
		</IdentificadoresInternos>
	</Entidad>
	<Entidad id="5">
		<Nombre>Funcion</Nombre>
		<TipoEntidad tipo="MAESTRA_COSA"/>
		<Atributos>
			<Atributo id="51">
				<Nombre>nroFunc</Nombre>
				<Cardinalidad min="1" max="1" />
				<TipoAtributo tipo="CARACTERIZACION"/>
			</Atributo>
			<Atributo id="52">
				<Nombre>fecha</Nombre>
				<Cardinalidad min="1" max="1" />
				<TipoAtributo tipo="CARACTERIZACION"/>
			</Atributo>
			<Atributo id="53">
				<Nombre>hora</Nombre>
				<Cardinalidad min="1" max="1" />
				<TipoAtributo tipo="CARACTERIZACION"/>
			</Atributo>
		</Atributos>
		<IdentificadoresInternos>
			<RefAtributo id="24" />
			<RefAtributo id="25" />
		</IdentificadoresInternos>
		<IdentificadoresExternos>
				<RefEntidad id="4" />
		</IdentificadoresExternos>
	</Entidad>
	<Relacion id="3">
		<Nombre>SL</Nombre>
		<TipoRelacion tipo="ASOCIACION"/>
		<Participantes>
			<Participante> 
				<RefEntidad id="0"/>
				<Cardinalidad min="1" max="1"/>
			</Participante> 
			<Participante>
				<RefEntidad id="2"/>
				<Cardinalidad min="1" max="n" />
			</Participante>
		</Participantes>
	</Relacion>
	<Relacion id="6">
		<Nombre>FO</Nombre>
		<TipoRelacion tipo="ASOCIACION"/>
		<Participantes> 
			<Participante>
				<RefEntidad id="4"/>
			 	<Cardinalidad min="0" max="n"/> 
			</Participante>
			<Participante>
				<RefEntidad id="5"/>
			 	<Cardinalidad min="1" max="1" />
			</Participante> 
		</Participantes>
	</Relacion>
	<Relacion id="7">
		<Nombre>VtaLoc</Nombre>
		<TipoRelacion tipo="ASOCIACION"/>
		<Participantes>
			<Participante>
				<RefEntidad id="4"/>
				<Cardinalidad min="0" max="n" />
			</Participante>
			<Participante>
			<RefEntidad id="0"/> 
			<Cardinalidad min="0" max="n" />
			</Participante>
		</Participantes>
		<Atributos>
			<Atributo id="71">
				<Nombre>tarj</Nombre>
				<Cardinalidad min="0" max="1" />
				<TipoAtributo tipo="CARACTERIZACION"/>
				<Atributos>
					<Atributo id="711">
						<Nombre>nomTarj</Nombre>
						<Cardinalidad min="1" max="1" />
						<TipoAtributo tipo="CARACTERIZACION"/>
					</Atributo>
					<Atributo id="712">
						<Nombre>bco</Nombre>
						<Cardinalidad min="1" max="1" />
						<TipoAtributo tipo="CARACTERIZACION"/>
					</Atributo>
					<Atributo id="713">
						<Nombre>nroTarj</Nombre>
						<Cardinalidad min="1" max="1" />
						<TipoAtributo tipo="CARACTERIZACION"/>
					</Atributo>
					<Atributo id="714">
						<Nombre>nroAutoriz</Nombre>
						<Cardinalidad min="1" max="1" />
						<TipoAtributo tipo="CARACTERIZACION"/>
					</Atributo>
					<Atributo id="715">
						<Nombre>cr</Nombre>
						<Cardinalidad min="0" max="1" />
						<TipoAtributo tipo="CARACTERIZACION"/>
						<Atributos>
							<Atributo id="7151">
								<Nombre>cuotas</Nombre>
								<Cardinalidad min="1" max="1" />
								<TipoAtributo tipo="CARACTERIZACION"/>
							</Atributo>
							<Atributo id="7152">
								<Nombre>int</Nombre>
								<Cardinalidad min="0" max="1" />
								<TipoAtributo tipo="CARACTERIZACION"/>
							</Atributo>
						</Atributos>
					</Atributo>
				</Atributos>
			</Atributo>
		</Atributos>
	</Relacion>
	<Diagrama id="99">
		<Nombre>BoleteriaTeatro</Nombre>
		<Componentes>
			<RefComponente id="0" />
			<RefComponente id="2" />
			<RefComponente id="3" />
			<RefComponente id="4" />
			<RefComponente id="5" />
			<RefComponente id="6" />
			<RefComponente id="7" />
		</Componentes>
		<Validacion estado="SIN_VALIDAR">
			<Observaciones/>
		</Validacion> 
	</Diagrama>
	<!-- Estado global de los diagramas -->
	<Validacion estado="SIN_VALIDAR">
		<Observaciones/>
	</Validacion> 
</Modelo>
