<!DOCTYPE note SYSTEM "../modelo-comp.dtd">
<Modelo>
	<Entidad id="_1" tipo="MAESTRA_COSA">
		<Nombre>Intérprete</Nombre>
		<Atributos>
			<Atributo id="_11" tipo="CARACTERIZACION">
				<Nombre>idIntérp</Nombre>
				<Cardinalidad min="1" max="" />
			</Atributo>
			<Atributo id="_12" tipo="CARACTERIZACION">
				<Nombre>nombre</Nombre>
				<Cardinalidad min="1" max="" />
			</Atributo>
		</Atributos>
		<IdentificadoresInternos>
			<RefAtributo id="_11" />
			<RefAtributo id="_12" />
		</IdentificadoresInternos>
	</Entidad>
	<Entidad id="_2" tipo="MAESTRA_COSA">
		<Nombre>Obra</Nombre>
		<Atributos>
			<Atributo id="_21" tipo="CARACTERIZACION">
				<Nombre>idObra</Nombre>
				<Cardinalidad min="1" max="" />
			</Atributo>
			<Atributo id="_22" tipo="CARACTERIZACION">
				<Nombre>título</Nombre>
				<Cardinalidad min="1" max="" />
			</Atributo>
			<Atributo id="_23" tipo="CARACTERIZACION">
				<Nombre>director</Nombre>
				<Cardinalidad min="1" max="n" />
			</Atributo>
			<Atributo id="_24" tipo="CARACTERIZACION">
				<Nombre>autor</Nombre>
				<Cardinalidad min="1" max="n" />
			</Atributo>
			<Atributo id="_25" tipo="CARACTERIZACION">
				<Nombre>genero</Nombre>
				<Cardinalidad min="1" max="" />
			</Atributo>
			<Atributo id="_26" tipo="CARACTERIZACION">
				<Nombre>enCartel</Nombre>
				<Cardinalidad min="0" max="1" />
				<Atributos>
					<Atributo id="_261" tipo="CARACTERIZACION">
						<Nombre>desde</Nombre>
						<Cardinalidad min="1" max="1" />
					</Atributo>
					<Atributo id="_262" tipo="CARACTERIZACION">
						<Nombre>hasta</Nombre>
						<Cardinalidad min="0" max="1" />
					</Atributo>
				</Atributos>
			</Atributo>
		</Atributos>
		<IdentificadoresInternos>
			<RefAtributo id="_21" />
		</IdentificadoresInternos>
		<IdentificadoresExternos>
			<IdentificadorExterno>
				<Atributo id="2" />
				<Atributo id="3" />
			</IdentificadorExterno>
		</IdentificadoresExternos>
	</Entidad>
	<Relacion id="_3" tipo="COMPOSICION">
		<Nombre>Elenco</Nombre>
		<Participantes>
			<Participante>
				<RefEntidad id="_1" />
				<Cardinalidad min="0" max="n" />
			</Participante>
			<Participante>
				<RefEntidad id="_2" />
				<Cardinalidad min="0" max="n" />
			</Participante>
		</Participantes>
	</Relacion>
	<Diagrama id="_4">
		<Nombre>Cartelera Teatral</Nombre>
		<Componentes>
			<Componente id="_1" />
			<Componente id="_2" />
			<Componente id="_3" />
		</Componentes>
		<Validacion estado="SIN_VALIDAR">
			<Observaciones/>
		</Validacion>
	</Diagrama>
	<!-- Estado global de los diagramas -->
	<Validacion estado="SIN_VALIDAR">
		<Observaciones/>
	</Validacion> 
</Modelo>
